Ephesians	Eph	10	1	16	ⲚϮⲖⲞ ⲀⲚ ⲈⲈⲒϢⲠϨⲘⲞⲦ ϨⲀⲢⲰⲦⲚ. ⲈⲒⲈⲒⲢⲈ ⲘⲠⲈⲦⲚⲘⲈⲈⲨⲈ ϨⲚ ⲚⲀϢⲖⲎⲖ.
Ephesians	Eph	10	1	17	ϪⲈⲔⲀⲀⲤ ⲈⲢⲈ ⲠⲚⲞⲨⲦⲈ ⲘⲠⲈⲚϪⲞⲈⲒⲤ ⲒⲎⲤⲞⲨⲤ ⲠⲈⲬⲢⲒⲤⲦⲞⲤ ⲠⲈⲒⲰⲦ ⲘⲠⲈⲞⲞⲨ. ⲈϤⲈϮ ⲚⲎⲦⲚ ⲚⲞⲨⲠⲚⲈⲨⲘⲀ ⲚⲤⲞⲪⲒⲀ ⲘⲚ ⲞⲨϬⲰⲖⲠ ⲈⲂⲞⲖ ϨⲘ ⲠⲈϤⲤⲞⲞⲨⲚ
Ephesians	Eph	10	1	18	ⲈⲢⲈ ⲚⲂⲀⲖ ⲘⲠⲈⲦⲚϨⲎⲦ ϪⲒ ⲞⲨⲞⲈⲒⲚ ⲈⲦⲢⲈⲦⲚⲈⲒⲘⲈ ϪⲈ ⲞⲨ ⲦⲈ ⲐⲈⲖⲠⲒⲤ ⲘⲠⲈϤⲦⲰϨⲘ. ⲞⲨ ⲦⲈ ⲦⲘⲚⲦⲢⲘⲘⲀⲞ ⲘⲠⲈⲞⲞⲨ ⲚⲦⲈϤⲔⲖⲎ ⲢⲞⲚⲞⲘⲒⲀ ϨⲚ ⲚⲈⲦⲞⲨⲀⲀⲂ.
Ephesians	Eph	10	1	19	ⲀⲨⲰ ⲞⲨ ⲠⲈ ⲠⲈϨⲞⲨⲞ ⲚⲦϬⲞⲦ ⲚⲦⲈϤϬⲞⲘ ⲈϨⲞⲨⲚ ⲈⲢⲞⲚ ⲚⲈⲦⲠⲒⲤⲦⲈⲨⲈ. ⲔⲀⲦⲀ ⲦⲈⲚⲈⲢⲄⲒⲀ ⲘⲠⲀⲘⲀϨⲦⲈ ⲚⲦⲈϤϬⲞⲘ.
Ephesians	Eph	10	1	20	ⲦⲀⲒ ⲈⲚⲦⲀϤⲈⲚⲈⲢⲄⲈⲒ ⲘⲘⲞⲤ ϨⲘ ⲠⲈⲬⲢⲒⲤⲦⲞⲤ ⲈⲀϤⲦⲞⲨⲚⲞⲤϤ ⲈⲂⲞⲖ ϨⲚ ⲚⲈⲦⲘⲞⲞⲨⲦ. ⲀϤⲐⲘⲤⲞϤ ϨⲒ ⲞⲨⲚⲀⲘ ⲘⲘⲞϤ ϨⲚ ⲘⲠⲎⲞⲨⲈ.
Ephesians	Eph	10	1	21	ⲈϤϪⲞⲤⲈ ⲈⲀⲢⲬⲎ ⲚⲒⲘ ϨⲒ ⲈⲜⲞⲨⲤⲒⲀ ⲚⲒⲘ ϨⲒ ϬⲞⲘ ⲚⲒⲘ ϨⲒ ⲘⲚ ⲦϪⲞⲈⲒⲤ ⲚⲒⲘ ϨⲒⲢⲀⲚ ⲚⲒⲘ ⲈϢⲀⲨⲦⲀⲨⲞϤ ⲞⲨ ⲘⲞⲚⲞⲚ ϨⲘ ⲠⲈⲒⲀⲒⲰⲚ ⲀⲖⲖⲀ ϨⲘ ⲠⲔⲈⲞⲨⲀ.
Ephesians	Eph	10	1	22	ⲀⲨⲰ ⲚⲔⲀ ⲚⲒⲘ ⲀϤⲐⲂⲂⲒⲞⲞⲨ ϨⲀ ⲚⲈϤⲞⲨⲈⲢⲎⲦⲈ. ⲀⲨⲰ ⲀϤⲦⲀⲀϤ ⲚⲀⲠⲈ ϨⲀ ⲠⲦⲎⲢϤ ⲚⲦⲈⲔⲔⲖⲎⲤⲒⲀ
Ephesians	Eph	10	1	23	ⲈⲦⲈ ⲦⲀⲒ ⲦⲈ ⲠⲈϤⲤⲰⲘⲀ. ⲠϪⲰⲔ ⲈⲂⲞⲖ ⲘⲠⲈⲦϪⲎⲔ ⲈⲂⲞⲖ ⲚϨⲰⲂ ⲚⲒⲘ ϨⲘ ⲠⲦⲎⲢϤ.
Ephesians	Eph	10	2	1	ⲀⲨⲰ ⲚⲦⲰⲦⲚ ⲈⲦⲈⲦⲚⲘⲞⲞⲨⲦ ϨⲚ ⲚⲈⲦⲚⲠⲀⲢⲀⲠⲦⲰⲘⲀ ⲘⲚ ⲚⲈⲦⲚⲚⲞⲂⲈ.
Ephesians	Eph	10	2	2	ⲚⲀⲒ ⲈⲚⲦⲀⲦⲈⲦⲚⲘⲞⲞϢⲈ ⲚϨⲎⲦⲞⲨ ⲘⲠⲒⲞⲨⲞⲈⲒϢ ⲔⲀⲦⲀ ⲠⲀⲒⲰⲚ ⲘⲠⲈⲈⲒⲔⲞⲤⲘⲞⲤ ⲔⲀⲦⲀ ⲠⲀⲢⲬⲰⲚ ⲚⲦⲈⲜⲞⲨⲤⲒⲀ ⲘⲠⲀⲎⲢ ⲘⲠⲈⲠⲚⲈⲨⲘⲀ. ⲠⲀⲒ ⲈⲦⲈⲚⲈⲢⲄⲒ ⲦⲈⲚⲞⲨ ϨⲚ ⲚϢⲎⲢⲈ ⲚⲦⲘⲚⲦⲀⲦⲚⲀϨⲦⲈ.
Ephesians	Eph	10	2	3	ⲈⲀⲚⲘⲞⲞϢⲈ ϨⲰⲰⲚ ϨⲚ ⲚⲀⲒ ⲘⲠⲒⲞⲨⲞⲈⲒϢ ϨⲚ ⲚⲈⲠⲒⲐⲨⲘⲒⲀ ⲚⲦⲈⲚⲤⲀⲢⲜ ⲈⲚⲈⲒⲢⲈ ⲚⲚⲞⲨⲰϢ ⲚⲦⲤⲀⲢⲜ ⲘⲚ ⲚⲈⲚⲘⲈⲈⲨⲈ ⲀⲨⲰ ⲈⲚϢⲞⲞⲠ ⲪⲨⲤⲈⲒ ⲚϢⲎⲢⲈ ⲚⲦⲞⲢⲄⲎ ⲚⲐⲈ ⲘⲠⲔⲈⲤⲈⲈⲠⲈ ⲚⲚⲢⲰⲘⲈ.
Ephesians	Eph	10	2	4	ⲠⲚⲞⲨⲦⲈ ⲆⲈ ⲈⲨⲢⲘⲘⲀⲞ ⲠⲈ ϨⲘ ⲠⲚⲀ ⲈⲦⲂⲈ ⲦⲈϤⲀⲄⲀⲠⲎ ⲈⲦⲚⲀϢⲰⲤ ⲈⲚⲦⲀϤⲘⲈⲢⲒⲦⲚ ⲚϨⲎⲦⲤ.
Ephesians	Eph	10	2	5	ⲀⲨⲰ ⲈⲚⲘⲞⲞⲨⲦ ϨⲚ ⲚⲈⲚⲠⲀⲢⲀⲠⲦⲰⲘⲀ ⲀϤⲦⲀⲚϨⲞⲚ ϨⲘ ⲠⲈⲬⲢⲒⲤⲦⲞⲤ. ⲈⲦⲈⲦⲚⲦⲞⲨϪⲎⲨ ⲄⲀⲢ ϨⲚ ⲞⲨϨⲘⲞⲦ
Ephesians	Eph	10	2	6	ⲀⲨⲰ ⲀϤⲦⲞⲨⲚⲞⲤⲚ ⲚⲘⲘⲀϤ. ⲀⲨⲐⲘⲤⲞⲚ ⲚⲘⲘⲀϤ ϨⲚ ⲘⲠⲎⲨⲈ ϨⲘ ⲠⲈⲬⲢⲒⲤⲦⲞⲤ ⲒⲎⲤⲞⲨⲤ.
Ephesians	Eph	10	2	7	ϪⲈⲔⲀⲀⲤ ⲈϤⲈⲞⲨⲰⲚϨ ⲈⲂⲞⲖ ϨⲚ ⲚⲈⲨⲞⲈⲒϢ ⲈⲦⲚⲎⲨ ⲘⲠⲈϨⲞⲨⲈ ⲘⲚⲦⲢⲘⲘⲀⲞ ⲚⲦⲈⲦⲈϤⲬⲀⲢⲒⲤ ϨⲚ ⲞⲨⲘⲚⲦⲬⲢⲎⲤⲦⲞⲤ ⲈϨⲢⲀⲒ ⲈϪⲰⲚ ϨⲘ ⲠⲈⲬⲢⲒⲤⲦⲞⲤ ⲒⲎⲤⲞⲨⲤ.
Ephesians	Eph	10	2	8	ⲚⲦⲀⲨⲦⲀⲚϨⲈⲦ ⲦⲎⲨⲦⲚ ⲄⲀⲢ ϨⲚ ⲦⲈϤⲬⲀⲢⲒⲤ ϨⲒⲦⲚ ⲦⲠⲒⲤⲦⲒⲤ. ⲀⲨⲰ ⲠⲈⲈⲒⲔⲈ ⲚⲞⲨⲈⲂⲞⲖ ⲘⲘⲰⲦⲚ ⲀⲚ ⲠⲈ. ⲠⲦⲀⲈⲒⲞ ⲠⲀ ⲠⲚⲞⲨⲦⲈ ⲠⲈ
Ephesians	Eph	10	2	9	ⲚⲞⲨⲈⲂⲞⲖ ϨⲚ ϨⲰⲂ ⲀⲚ ⲠⲈ. ϪⲈ ⲚⲚⲈ ⲞⲨⲀ ϢⲞⲨϢⲞⲨ ⲘⲘⲞϤ.
Ephesians	Eph	10	2	10	ⲀⲚⲞⲚ ⲄⲀⲢ ⲀⲚⲞⲚ ⲠⲈϤⲦⲀⲘⲒⲞ. ⲈⲀϤⲤⲞⲚⲦⲚ ϨⲘ ⲠⲈⲬⲢⲒⲤⲦⲞⲤ ⲒⲎⲤⲞⲨⲤ ⲈϪⲚ ϨⲈⲚϨⲂⲎⲨⲈ ⲈⲚⲀⲚⲞⲨⲞⲨ. ⲚⲀⲒ ⲈⲚⲦⲀ ⲠⲚⲞⲨⲦⲈ ϢⲢⲠ ⲤⲂⲦⲰⲦⲞⲨ ϪⲈⲔⲀⲀⲤ ⲈⲚⲈⲘⲞⲞϢⲈ ϨⲢⲀⲒ ⲚϨⲎⲦⲞⲨ.
Ephesians	Eph	10	2	11	ⲈⲦⲂⲈ ⲠⲀⲒ ⲀⲢⲒⲠⲘⲈⲈⲨⲈ ϪⲈ ⲚⲦⲰⲦⲚ ⲘⲠⲒⲞⲨⲞⲈⲒϢ ⲚϨⲈⲐⲚⲞⲤ ⲚⲈⲦⲞⲨⲘⲞⲨⲦⲈ ⲈⲢⲞⲞⲨ ϪⲈ ⲦⲘⲚⲦⲀⲦⲤⲂⲂⲈ ϨⲚ ⲦⲤⲀⲢⲜ. ⲈⲂⲞⲖ ϨⲒⲦⲘ ⲠⲈϢⲀⲨⲘⲞⲨⲦⲈ ⲈⲢⲞϤ ϪⲈ ⲠⲤⲂⲂⲈ ⲚϬⲒϪ ϨⲚ ⲦⲤⲀⲢⲜ.
Ephesians	Eph	10	2	12	ϪⲈ ⲚⲈⲦⲈⲦⲚϢⲞⲞⲠ ⲘⲠⲈⲨⲞⲈⲒϢ ⲈⲦⲘⲘⲀⲨ ⲀϪⲚ ⲠⲈⲬⲢⲒⲤⲦⲞⲤ ⲈⲦⲈⲦⲚⲞ ⲚⲀⲖⲖⲞⲦⲢⲒⲞⲤ ⲈⲦⲠⲞⲖⲒⲦⲒⲀ ⲘⲠⲒⲤⲢⲀⲎⲖ ⲀⲨⲰ ⲚϢⲘⲘⲞ ⲈⲚⲆⲒⲀⲐⲎⲔⲎ ⲘⲠⲈⲢⲎⲦ ⲈⲘⲚⲦⲎⲦⲚ ϨⲈⲖⲠⲒⲤ ⲘⲘⲀⲨ ⲀⲨⲰ ⲈⲦⲈⲦⲚⲞ ⲚⲀⲦⲚⲞⲨⲦⲈ ϨⲘ ⲠⲔⲞⲤⲘⲞⲤ.
Ephesians	Eph	10	2	13	ⲦⲈⲚⲞⲨ ⲆⲈ ⲦⲈⲦⲚϨⲘ ⲠⲈⲬⲢⲒⲤⲦⲞⲤ ⲒⲎⲤⲞⲨⲤ. ⲚⲦⲰⲦⲚ ⲘⲠⲒⲞⲨⲞⲈⲒϢ ⲈⲦⲘⲠⲞⲨⲈ. ⲀⲦⲈⲦⲚϢⲰⲠⲈ ⲈⲦⲈⲦⲚϨⲎⲚ ⲈϨⲞⲨⲚ ϨⲘ ⲠⲈⲤⲚⲞϤ ⲘⲠⲈⲬⲢⲒⲤⲦⲞⲤ.
Ephesians	Eph	10	2	14	ⲚⲦⲞϤ ⲄⲀⲢ ⲠⲈ ⲦⲈⲚⲈⲒⲢⲎⲚⲎ ⲠⲈⲚⲦⲀϤⲢⲠⲈⲤⲚⲀⲨ ⲚⲞⲨⲀ ⲈⲀϤⲂⲰⲖ ⲈⲂⲞⲖ ⲚⲦϪⲈ ⲚⲈⲦⲘⲎⲦⲈ ⲘⲠϪⲞⲖϪⲖ ⲦⲘⲚⲦϪⲀϪⲈ ϨⲚ ⲦⲈϤⲤⲀⲢⲜ.
Ephesians	Eph	10	2	15	ⲈⲀϤⲞⲨⲰⲤϤ ⲘⲠⲚⲞⲘⲞⲤ ⲚⲚⲈⲚⲦⲞⲖⲎ ϨⲚ ⲚⲆⲞⲄⲘⲀ. ϪⲈⲔⲀⲀⲤ ⲈϤⲈⲤⲰⲚⲦ ⲘⲠⲈⲤⲚⲀⲨ ⲚϨⲎⲦϤ ⲈⲨⲢⲰⲘⲈ ⲚⲞⲨⲰⲦ ⲚⲂⲢⲢⲈ ⲈϤⲈⲒⲢⲈ ⲚⲞⲨⲈⲒⲢⲎⲚⲎ.
Ephesians	Eph	10	2	16	ⲀⲨⲰ ⲚϤϨⲞⲦⲠⲞⲨ ⲘⲠⲈⲤⲚⲀⲨ ϨⲚ ⲞⲨⲤⲰⲘⲀ ⲚⲞⲨⲰⲦ ⲈⲠⲚⲞⲨⲦⲈ ϨⲒⲦⲘ ⲠⲈⲤⲦⲀⲨⲢⲞⲤ. ⲈⲀϤⲘⲞⲨⲞⲨⲦ ⲚⲦⲘⲚⲦϪⲀϪⲈ ⲚϨⲎⲦϤ.
Ephesians	Eph	10	2	17	ⲀϤⲈⲒ ⲀϤⲈⲨⲀⲄⲄⲈⲖⲒⲌⲈ ⲚⲞⲨⲈⲒⲢⲎⲚⲎ ⲚⲎⲦⲚ ⲚⲈⲦⲘⲠⲞⲨⲈ. ⲀⲨⲰ ⲞⲨⲈⲒⲢⲎⲚⲎ ⲚⲚⲈⲦϨⲎⲚ ⲈϨⲞⲨⲚ.
Ephesians	Eph	10	2	18	ϪⲈ ⲈⲂⲞⲖ ϨⲒⲦⲞⲞⲦϤ ⲞⲨⲚⲦⲀⲚ ⲘⲘⲀⲨ ⲘⲠⲈⲤⲚⲀⲨ ⲘⲠϨⲰⲚ ⲈϨⲞⲨⲚ ⲈⲠⲈⲒⲰⲦ ϨⲚ ⲞⲨⲠⲚⲈⲨⲘⲀ ⲚⲞⲨⲰⲦ.
Ephesians	Eph	10	2	19	ⲈⲒⲈ ⲚⲦⲈⲦⲚ ϨⲈⲚϢⲘⲘⲞ ⲀⲚ ϬⲈ ϨⲒⲢⲘ ⲚϬⲞⲒⲖⲈ. ⲀⲖⲖⲀ ⲚⲦⲈⲦⲚ ⲚⲢⲘⲚ ϮⲘⲈ ⲚⲚⲈⲦⲞⲨⲀⲀⲂ. ⲀⲨⲰ ⲚⲢⲘⲚⲎⲈⲒ ⲘⲠⲚⲞⲨⲦⲈ.
Ephesians	Eph	10	2	20	ⲈⲀⲨⲔⲈⲦ ⲦⲎⲨⲦⲚ ⲈϨⲢⲀⲒ ⲈϪⲚ ⲦⲤⲚⲦⲈ ⲚⲚⲀⲠⲞⲤⲦⲞⲖⲞⲤ ⲘⲚ ⲚⲈⲠⲢⲞⲪⲎⲦⲎⲤ ⲈⲢⲈ ⲠⲈⲬⲢⲒⲤⲦⲞⲤ ⲒⲎⲤⲞⲨⲤ ⲞⲚⲰⲚⲈ ⲚⲔⲞⲞϨ
Ephesians	Eph	10	2	21	ⲠⲀⲒ ⲈⲦⲈⲢⲈ ⲠⲔⲰⲦ ⲦⲎⲢϤ ϢⲰⲚⲂ ⲚϨⲎⲦϤ. ⲈϤⲀⲨⲜⲀⲚⲈ ⲈⲨⲢⲠⲈ ⲈϤⲞⲨⲀⲀⲂ ⲘⲠϪⲞⲈⲒⲤ.
Ephesians	Eph	10	2	22	ⲠⲀⲒ ϨⲰⲦ ⲦⲎⲨⲦⲚ ⲈⲦⲞⲨⲔⲰⲦ ⲘⲘⲰⲦⲚ ⲚϨⲎⲦϤ ⲈⲨⲘⲀ ⲚⲞⲨⲰϨ ⲘⲠⲚⲞⲨⲦⲈ ϨⲘ ⲠⲈⲠⲚⲈⲨⲘⲀ.
Ephesians	Eph	10	3	1	ⲈⲦⲂⲈ ⲠⲀⲒ ⲀⲚⲞⲔ ⲠⲀⲨⲖⲞⲤ ⲠⲈⲦⲘⲎⲢ ⲚⲦⲈ ⲠⲈⲬⲢⲒⲤⲦⲞⲤ ϨⲀⲢⲰⲦⲚ ⲚϨⲈⲐⲚⲞⲤ.
Ephesians	Eph	10	3	2	ⲈϢϪⲈ ⲀⲦⲈⲦⲚⲤⲰⲦⲘ ⲈⲦⲞⲒⲔⲞⲚⲞⲘⲒⲀ ⲚⲦⲈⲬⲀⲢⲒⲤ ⲘⲠⲚⲞⲨⲦⲈ ⲈⲚⲦⲀⲨⲦⲀⲀⲤ ⲚⲀⲒ ⲈϨⲞⲨⲚ ⲈⲢⲰⲦⲚ.
Ephesians	Eph	10	3	3	ϪⲈ ⲔⲀⲦⲀ ⲞⲨϬⲰⲖⲠ ⲈⲂⲞⲖ ⲀⲨⲦⲀⲘⲞⲒ ⲈⲠⲘⲨⲤⲦⲎⲢⲒⲞⲚ. ⲔⲀⲦⲀ ⲐⲈ ⲈⲚⲦⲀⲒⲤϨⲀⲒ ⲚϢⲞⲢⲠ ϨⲚ ⲞⲨⲔⲞⲨⲒ
Ephesians	Eph	10	3	4	ⲠⲢⲞⲤ ⲐⲈ ⲈⲦⲈⲦⲚⲀϢϬⲘϬⲞⲘ ⲘⲘⲞⲤ ⲈⲦⲈⲦⲚⲰϢ ⲈⲚⲞⲒ ⲚⲦⲀⲘⲚⲦⲤⲀⲂⲈ ϨⲘ ⲠⲘⲨⲤⲦⲎⲢⲒⲞⲚ ⲘⲠⲈⲬⲢⲒⲤⲦⲞⲤ.
Ephesians	Eph	10	3	5	ⲠⲀⲒ ⲈⲦⲘⲠⲞⲨⲞⲨⲞⲚϨϤ ⲈⲂⲞⲖ ϨⲚ ϨⲈⲚⲔⲈⲄⲈⲚⲈⲀ ⲚϢⲎⲢⲈ ⲚⲚⲢⲰⲘⲈ. ⲚⲐⲈ ⲈⲚⲦⲀⲨϬⲞⲖⲠϤ ⲈⲂⲞⲖ ⲦⲈⲚⲞⲨ ⲚⲚⲈϤⲀⲠⲞⲤⲦⲞⲖⲞⲤ ⲈⲦⲞⲨⲀⲀⲂ. ⲘⲚ ⲚⲈⲠⲢⲞⲪⲎⲦⲎⲤ ϨⲘ ⲠⲈⲠⲚⲈⲨⲘⲀ.
Ephesians	Eph	10	3	6	ⲈⲦⲢⲈ ⲚϨⲈⲐⲚⲞⲤ ϢⲰⲠⲈ ⲚⲤⲨⲚⲔⲖⲎⲢⲞⲚⲞⲘⲞⲤ ⲘⲚ ⲞⲨⲤⲰⲘⲀ ⲚⲞⲨⲰⲦ. ⲀⲨⲰ ⲚⲤⲨⲘⲘⲈⲦⲞⲬⲞⲤ ⲘⲠⲈⲢⲎⲦ ⲘⲠⲈⲬⲢⲒⲤⲦⲞⲤ ⲒⲎⲤⲞⲨⲤ ϨⲒⲦⲘ ⲠⲈⲨⲀⲄⲄⲈⲖⲒⲞⲚ.
Ephesians	Eph	10	3	7	ⲠⲀⲒ ⲈⲚⲦⲀⲒϢⲰⲠⲈ ⲚⲀϤ ⲚⲆⲒⲀⲔⲞⲚⲞⲤ. ⲔⲀⲦⲀ ⲦⲆⲰⲢⲈⲀ ⲚⲦⲈⲬⲀⲢⲒⲤ ⲈⲚⲦⲀⲨⲦⲀⲀⲤ ⲚⲀⲒ. ⲔⲀⲦⲀ ⲦⲈⲚⲈⲢⲄⲒⲀ ⲚⲦⲈϤϬⲞⲘ.
Ephesians	Eph	10	3	8	ⲀⲨϮ ⲚⲀⲒ ⲚⲦⲈⲈⲒⲬⲀⲢⲒⲤ ⲠⲈⲖⲀⲬⲒⲤⲦⲞⲤ ⲚⲚⲈⲦⲞⲨⲀⲀⲂ ⲦⲎⲢⲞⲨ. ⲈⲦⲢⲀⲈⲨⲀⲄⲄⲈⲖⲒⲌⲈ ⲚⲚϨⲈⲐⲚⲞⲤ ⲚⲦⲘⲚⲦⲢⲘⲘⲀⲞ ⲈⲦⲚⲀϢⲰⲤ ⲘⲠⲈⲬⲢⲒⲤⲦⲞⲤ.
Ephesians	Eph	10	3	9	ⲀⲨⲰ ⲈⲦⲀⲘⲈ ⲞⲨⲞⲚ ⲚⲒⲘ ϪⲈ ⲞⲨ ⲦⲈ ⲦⲞⲒⲔⲞⲚⲞⲘⲒⲀ ⲘⲠⲘⲨⲤⲦⲎⲢⲒⲞⲚ ⲈⲐⲎⲠ ϪⲒⲚ ⲈⲚⲈϨ ϨⲘ ⲠⲚⲞⲨⲦⲈ ⲠⲈⲚⲦⲀϤⲤⲚⲦ ⲚⲔⲀ ⲚⲒⲘ.
Ephesians	Eph	10	3	10	ϪⲈ ⲈⲨⲈⲞⲨⲰⲚϨ ⲦⲈⲚⲞⲨ ⲈⲂⲞⲖ ⲚⲚⲀⲢⲬⲎ. ⲘⲚ ⲚⲈⲜⲞⲨⲤⲒⲀ ϨⲚ ⲘⲠⲎⲨⲈ. ⲈⲂⲞⲖ ϨⲒⲦⲚ ⲦⲈⲔⲔⲖⲎⲤⲒⲀ ⲦⲤⲞⲪⲒⲀ ⲚⲀⲦⲈⲤⲘⲞⲦ ⲚⲦⲈ ⲠⲚⲞⲨⲦⲈ.
Ephesians	Eph	10	3	11	ⲔⲀⲦⲀ ⲠⲦⲰϢ ⲚⲚⲀⲒⲰⲚ. ⲦⲀⲒ ⲈⲚⲦⲀϤⲦⲀⲀⲤ ϨⲘ ⲠⲈⲬⲢⲒⲤⲦⲞⲤ ⲒⲎⲤⲞⲨⲤ ⲠⲈⲚϪⲞⲈⲒⲤ
Ephesians	Eph	10	3	12	ⲠⲀⲒ ⲈⲦⲈⲨⲚⲦⲀⲚ ⲦⲠⲀⲢϨⲎⲤⲒⲀ ⲚϨⲎⲦϤ ⲘⲚ ⲠϨⲰⲚ ⲈϨⲞⲨⲚ ϨⲘ ⲠⲚⲀϨⲦⲈ ϨⲒⲦⲚ ⲦⲈϤⲠⲒⲤⲦⲒⲤ.
Ephesians	Eph	10	3	13	ⲈⲦⲂⲈ ⲠⲀⲒ ϮⲀⲒⲦⲈⲒ ⲈⲦⲘⲈⲄⲔⲀϬⲈⲒ ϨⲚ ⲚⲀⲐⲖⲒⲮⲒⲤ ϨⲀⲢⲰⲦⲚ ⲈⲦⲈ ⲠⲀⲒ ⲠⲈ ⲠⲈⲦⲚⲈⲞⲞⲨ.
Ephesians	Eph	10	3	14	ⲈⲦⲂⲈ ⲠⲀⲒ ϮⲔⲰⲖϪ ⲚⲚⲀⲠⲀⲦ ⲘⲠⲈⲒⲰⲦ
Ephesians	Eph	10	3	15	ⲠⲀⲒ ⲈϢⲀⲨⲦⲀⲨⲈ ⲘⲚⲦⲈⲒⲰⲦ ⲚⲒⲘ ⲈⲂⲞⲖ ⲘⲘⲞϤ ϨⲚ ⲘⲠⲎⲨⲈ. ⲀⲨⲰ ϨⲒϪⲘ ⲠⲔⲀϨ.
Ephesians	Eph	10	3	16	ϪⲈⲔⲀⲀⲤ ⲈϤⲈϮ ⲚⲎⲦⲚ ⲔⲀⲦⲀ ⲦⲘⲚⲦⲢⲘⲘⲀⲞ ⲘⲠⲈϤⲈⲞⲞⲨ. ⲈⲠⲦⲀϪⲢⲈ ⲦⲎⲨⲦⲚ ϨⲚ ⲞⲨϬⲞⲘ ϨⲒⲦⲘ ⲠⲈϤⲠⲚⲈⲨⲘⲀ.
Ephesians	Eph	10	3	17	ⲈⲦⲢⲈ ⲠⲈⲬⲢⲒⲤⲦⲞⲤ ⲞⲨⲰϨ ϨⲘ ⲠⲢⲰⲘⲈ ⲈⲦϨⲒ ϨⲞⲨⲚ ϨⲒⲦⲚ ⲦⲠⲒⲤⲦⲒⲤ ϨⲚ ⲚⲈⲦⲚϨⲎⲦ.
Ephesians	Eph	10	3	18	ⲈⲦⲈⲦⲚϪⲈ ⲚⲞⲨⲚⲈ ⲈⲂⲞⲖ ϨⲒ ⲤⲚⲦⲈ ϨⲚ ⲞⲨⲀⲄⲀⲠⲎ ϪⲈⲔⲀⲀⲤ ⲈⲦⲈⲦⲚⲀϢϬⲘϬⲞⲘ ⲈⲈⲒⲘⲈ ⲘⲚ ⲚⲈⲦⲞⲨⲀⲀⲂ ⲦⲎⲢⲞⲨ ϪⲈ ⲞⲨ ⲠⲈ ⲠⲞⲨⲰϢⲤ ⲘⲚ ⲠⲈϢⲒⲀⲒ ⲘⲚ ⲠϪⲒⲤⲈ ⲘⲚ ⲠϢⲒⲔⲈ.
Ephesians	Eph	10	3	19	ⲈⲤⲞⲨⲚ ⲠⲈϨⲞⲨⲞ ⲚⲦⲀⲄⲀⲠⲎ ⲘⲠⲤⲞⲞⲨⲚ ⲘⲠⲈⲬⲢⲒⲤⲦⲞⲤ. ϪⲈⲔⲀⲀⲤ ⲈϤⲈϪⲰⲔ ⲈⲂⲞⲖ ⲚϬⲒ ⲠϪⲰⲔ ⲦⲎⲢϤ ⲘⲠⲚⲞⲨⲦⲈ.
Ephesians	Eph	10	3	20	ⲠⲈⲦⲈⲨⲚϬⲞⲘ ⲆⲈ ⲘⲘⲞϤ ⲈⲈⲒⲢⲈ ⲚϨⲞⲨⲈ ϨⲰⲂ ⲚⲒⲘ. ⲈϨⲞⲨⲈ ⲚⲈⲦⲚⲀⲒⲦⲒ ⲘⲘⲞⲞⲨ ⲎⲚⲈⲦⲚⲚⲞⲒ ⲘⲘⲞⲞⲨ. ⲔⲀⲦⲀ ⲦϬⲞⲘ ⲈⲦⲈⲚⲈⲢⲄⲈⲒ ⲚϨⲎⲦⲚ.
Ephesians	Eph	10	3	21	ⲠⲈⲞⲞⲨ ⲚⲀϤ ϨⲚ ⲦⲈⲔⲔⲖⲎⲤⲒⲀ ϨⲘ ⲠⲈⲬⲢⲒⲤⲦⲞⲤ ⲒⲎⲤⲞⲨⲤ ⲈϪⲰⲘ ⲚⲒⲘ ϢⲀ ⲈⲚⲈϨ ⲚⲈⲚⲈϨ ϨⲀⲘⲎⲚ.
Ephesians	Eph	10	4	1	ϮⲠⲀⲢⲀⲔⲀⲖⲈⲒ ϬⲈ ⲘⲘⲰⲦⲚ ⲀⲚⲞⲔ ⲠⲈⲦⲘⲎⲢϨⲘ ⲠϪⲞⲈⲒⲤ. ⲈⲦⲢⲈⲦⲚⲘⲞⲞϢⲈ ϨⲘ ⲠⲈⲘⲠϢⲀ ⲘⲠⲦⲰϨⲘ ⲈⲚⲦⲀⲨⲦⲈϨⲘ ⲦⲎⲨⲦⲚ ⲘⲘⲞϤ
Ephesians	Eph	10	4	2	ϨⲚ ⲐⲂⲂⲒⲞ ⲚⲒⲘ. ϨⲒ ⲘⲚⲦⲢⲘⲢⲀϢ. ϨⲚ ⲞⲨⲘⲚⲦϨⲀⲢϢϨⲎⲦ ⲈⲦⲈⲦⲚⲀⲚⲈⲬⲈ ⲚⲚⲈⲦⲚⲈⲢⲎⲨ ϨⲚ ⲦⲀⲄⲀⲠⲎ.
Ephesians	Eph	10	4	3	ⲈⲦⲈⲦⲚϬⲈⲠⲎ ⲈϨⲀⲢⲈϨ ⲈⲦⲘⲚⲦⲞⲨⲀ ⲘⲠⲈⲠⲚⲈⲨⲘⲀ ϨⲚ ⲦⲘⲢⲢⲈ ⲚϮⲢⲎⲚⲎ
Ephesians	Eph	10	4	4	ⲈⲦⲈⲦⲚⲞ ⲚⲞⲨⲤⲰⲘⲀ ⲚⲞⲨⲰⲦ. ⲞⲨⲠⲚⲈⲨⲘⲀ ⲚⲞⲨⲰⲦ. ⲔⲀⲦⲀ ⲐⲈ ⲈⲚⲦⲀⲨⲦⲈϨⲘ ⲦⲎⲨⲦⲚ ϨⲚ ⲞⲨⲚⲀϨⲦⲈ ⲚⲞⲨⲰⲦ ⲘⲠⲈⲦⲚⲦⲰϨⲘ.
Ephesians	Eph	10	4	5	ⲞⲨϪⲞⲈⲒⲤ ⲚⲞⲨⲰⲦ ⲞⲨⲠⲒⲤⲦⲒⲤ ⲚⲞⲨⲰⲦ ⲞⲨⲂⲀⲠⲦⲒⲤⲘⲀ ⲚⲞⲨⲰⲦ.
Ephesians	Eph	10	4	6	ⲞⲨⲚⲞⲨⲦⲈ ⲚⲞⲨⲰⲦ ⲠⲈⲒⲰⲦ ⲚⲞⲨⲞⲚ ⲚⲒⲘ. ⲠⲈⲦϨⲒϪⲚ ⲞⲨⲞⲚ ⲚⲒⲘ. ⲀⲨⲰ ⲈⲂⲞⲖ ϨⲒ ⲦⲞⲞⲦⲞⲨ ⲦⲎⲢⲞⲨ ⲈϤϨⲘ ⲠⲦⲎⲢϤ.
Ephesians	Eph	10	4	7	ⲀⲨϮϨⲘⲞⲦ ⲆⲈ ⲘⲠⲞⲨⲀ ⲠⲞⲨⲀ ⲘⲘⲞⲚ ⲔⲀⲦⲀ ⲠϢⲒ ⲚⲦⲆⲰⲢⲈⲀ ⲘⲠⲈⲬⲢⲒⲤⲦⲞⲤ.
Ephesians	Eph	10	4	8	ⲈⲦⲂⲈ ⲠⲀⲒ ϢⲀϤϪⲞⲞⲤ ϪⲈ ⲀϤⲀⲖⲈ ⲈⲠϪⲒ ⲤⲈ. ⲀϤⲀⲒⲬⲘⲀⲖⲰⲦⲈⲨⲈ ⲚⲞⲨⲀⲒⲬⲘⲀⲖⲰⲤⲒⲀ ⲀϤϮ ⲚϨⲈⲚⲦⲀⲒⲞ ⲚⲚⲢⲰⲘⲈ.
Ephesians	Eph	10	4	9	ⲞⲨⲆⲈ ⲠⲈ ⲀϤⲂⲰⲔ ⲈϨⲢⲀⲒ. ⲚⲤⲀⲂⲎⲖ ⲢⲰ ϪⲈ ⲀϤⲂⲰⲔ ⲚϢⲞⲢⲠ ⲈⲠⲈⲤⲎⲦ
Ephesians	Eph	10	4	10	ⲠⲈⲚⲦⲀϤⲂⲰⲔ ⲈⲠⲈⲤⲎⲦ ⲈⲚⲈⲦϢⲎⲔ ⲘⲠⲔⲀϨ ⲚⲦⲞϤ ⲞⲚ ⲠⲈⲚⲦⲀϤⲂⲰⲔ ⲈϨⲢⲀⲒ ⲈⲦⲠⲈ ⲚⲘⲠⲎⲨⲈ ϪⲈⲔⲀⲀⲤ ⲈϤⲈϪⲈⲔ ⲠⲦⲎⲢϤ ⲈⲂⲞⲖ.
Ephesians	Eph	10	4	11	ⲀⲨⲰ ⲚⲦⲞϤ ⲠⲈⲚⲦⲀϤϮϨⲞⲒⲚⲈ ⲘⲈⲚ ⲚⲀⲠⲞⲤⲦⲞⲖⲞⲤ ϨⲈⲚⲔⲞⲞⲨⲈ ⲆⲈ ⲘⲠⲢⲞⲪⲎⲦⲎⲤ ⲀⲨⲰ ϨⲞⲒⲚⲈ ⲚⲢⲈϤⲦⲀϢⲈⲞⲈⲒϢ ϨⲈⲚⲔⲞⲞⲨⲈ ⲚϢⲰⲤ ⲀⲨⲰ ⲚⲤⲀϨ.
Ephesians	Eph	10	4	12	ⲈⲠⲤⲞⲂⲦⲈ ⲚⲚⲈⲦⲞⲨⲀⲀⲂ ⲈⲠϨⲰⲂ ⲚⲦⲆⲒⲀⲔⲞⲚⲒⲀ. ⲈⲠⲔⲰⲦ ⲘⲠⲤⲰⲘⲀ ⲘⲠⲈⲬⲢⲒⲤⲦⲞⲤ.
Ephesians	Eph	10	4	13	ϢⲀⲚⲦⲚⲈⲒ ⲦⲎⲢⲚ ⲈⲠⲒⲘⲈⲈⲨⲈ ⲚⲞⲨⲰⲦ ⲚⲦⲈ ⲦⲠⲒⲤⲦⲒⲤ ⲘⲚ ⲠⲤⲞⲞⲨⲚ ⲘⲠϢⲎⲢⲈ ⲘⲠⲚⲞⲨⲦⲈ ⲈⲨⲢⲰⲘⲈ ⲚⲦⲈⲖⲒⲞⲤ ⲈⲠϢⲒ ⲚⲦϬⲞⲦ ⲘⲠϪⲰⲔ ⲈⲂⲞⲖ ⲘⲠⲈⲬⲢⲒⲤⲦⲞⲤ.
Ephesians	Eph	10	4	14	ϪⲈⲔⲀⲀⲤ ϬⲈ ⲚⲚⲈⲚϢⲰⲠⲈ ⲚϢⲎⲢⲈ ϢⲎⲘ ⲈⲢⲈⲠϨⲞⲈⲒⲘ ϤⲒ ⲘⲘⲞⲚ. ⲈⲚϢⲈⲈⲒ ⲘⲚⲦⲎⲨ ⲚⲒⲘ ⲚⲦⲈⲤⲂⲰ. ⲘⲚ ⲦⲔⲨⲂⲒⲀ ⲚⲚⲢⲰⲘⲈ ϨⲚ ⲞⲨⲠⲀⲚⲞⲨⲢⲄⲒⲀ ⲚⲚⲀϨⲢⲚ ⲚⲔⲞⲦⲤ ⲚⲦⲈⲠⲖⲀⲚⲎ.
Ephesians	Eph	10	4	15	ⲈⲚϪⲒⲘⲈ ⲆⲈ ⲚⲦⲞϤ ϨⲚ ⲞⲨⲀⲄⲀⲠⲎ. ⲚⲦⲚⲀⲨⲜⲀⲚⲈ ⲈϨⲞⲨⲚ ⲈⲢⲞϤ ⲘⲠⲦⲎⲢϤ. ⲈⲦⲈ ⲠⲀⲒ ⲠⲈ ⲦⲀⲠⲈ ⲠⲈⲬⲢⲒⲤⲦⲞⲤ.
Ephesians	Eph	10	4	16	ⲠⲀⲒ ⲈⲦⲈⲢⲈ ⲠⲤⲰⲘⲀ ⲦⲎⲢϤ ϢⲰⲚⲂ ⲈⲂⲞⲖ ⲘⲘⲞϤ. ⲀⲨⲰ ⲈϤⲀⲒⲀⲒ ϨⲒⲦⲚ ⲦⲢⲀ ⲚⲒⲘ ⲘⲠϮ ⲔⲀⲦⲀ ⲞⲨⲈⲚⲈⲢⲄⲒⲀ ϨⲘ ⲠϢⲒ ⲘⲠⲘⲈⲢⲞⲤ ⲠⲘⲈⲢⲞⲤ. ⲈⲦⲢⲈ ⲦⲀⲨⲜⲎⲤⲒⲤ ⲘⲠⲤⲰⲘⲀ ϢⲰⲠⲈ ⲈⲠⲈϤⲔⲰⲦ ϨⲚ ⲞⲨⲀⲄⲀⲠⲎ.
Ephesians	Eph	10	4	17	ⲈⲒϪⲰ ϬⲈ ⲘⲠⲀⲒ. ⲀⲨⲰ ⲈⲈⲒⲢⲘⲚⲦⲢⲈ ϨⲘ ⲠϪⲞⲈⲒⲤ. ⲈⲦⲘⲦⲢⲈⲦⲚⲘⲞⲞϢⲈ ϬⲈ ⲔⲀⲦⲀ ⲐⲈ ⲈⲦⲈⲢⲈ ⲚϨⲈⲐⲚⲞⲤ ⲘⲞⲞϢⲈ ⲘⲘⲞⲤ ϨⲘ ⲠⲠⲈⲦϢⲞⲨⲒⲦ ⲘⲠⲈⲨϨⲎⲦ ⲈⲨⲞ ⲚⲔⲀⲔⲈ ϨⲚ ⲚⲈⲨⲘⲈⲈⲨⲈ.
Ephesians	Eph	10	4	18	ⲈⲨⲞ ⲚⲀⲖⲖⲞⲦⲢⲒⲞⲤ ⲈⲠⲰⲚϨ ⲘⲠⲚⲞⲨⲦⲈ. ⲈⲦⲂⲈ ⲦⲘⲚⲦⲀⲦⲤⲞⲞⲨⲚ ⲈⲦϢⲞⲞⲠ ⲚϨⲎⲦⲞⲨ. ⲈⲦⲂⲈ ⲠⲈⲨⲦⲰⲘ ⲚϨⲎⲦ
Ephesians	Eph	10	4	19	ⲚⲀⲒ ⲈⲦⲈⲘⲠⲞⲨⲞⲨⲈϢ ⲘⲞⲔϨⲞⲨ. ⲀⲨⲦⲀⲀⲨ ⲘⲘⲒⲚ ⲘⲘⲞⲞⲨ ⲘⲠϪⲰϨⲘ ⲈⲠⲈⲢϨⲰⲂ ⲈⲀⲔⲀⲐⲀⲢⲤⲒⲀ ⲚⲒⲘ ϨⲚ ⲞⲨⲘⲚⲦⲘⲀⲒⲦⲞ ⲚϨⲞⲨⲞ.
Ephesians	Eph	10	4	20	ⲚⲦⲰⲦⲚ ⲆⲈ ⲚⲦⲀⲦⲈⲦⲚⲤⲂⲞ ⲀⲚ ⲈⲠⲈⲬⲢⲒⲤⲦⲞⲤ ⲚⲦⲈⲒϨⲈ.
Ephesians	Eph	10	4	21	ⲈϢϪⲈ ⲀⲦⲈⲦⲚⲤⲞⲦⲘⲈϤ ⲀⲨⲰ ⲀⲨⲦⲤⲀⲂⲈ ⲦⲎⲨⲦⲚ ⲚϨⲎⲦϤ. ⲔⲀⲦⲀ ⲐⲈ ϪⲈ ⲞⲨⲘⲈ ⲦⲈⲦϨⲚ ⲒⲎⲤⲞⲨⲤ.
Ephesians	Eph	10	4	22	ⲈⲔⲰ ⲚⲤⲰⲦⲚ ⲚⲚⲈⲦⲚϨⲂⲎⲨⲈ ⲚϢⲞⲢⲠ. ⲠⲈⲦⲚⲢⲰⲘⲈ ⲚⲀⲤ ⲠⲀⲒ ⲈⲦⲦⲀⲔⲞ ⲔⲀⲦⲀ ⲚⲈⲠⲒⲐⲨⲘⲒⲀ ⲚⲦⲀⲠⲀⲦⲎ.
Ephesians	Eph	10	4	23	ⲈⲢⲂⲢⲢⲈ ⲆⲈ ϨⲘ ⲠⲈⲠⲚⲈⲨⲘⲀ ⲘⲠⲈⲦⲚϨⲎⲦ.
Ephesians	Eph	10	4	24	ⲀⲨⲰ ⲈϮ ϨⲒⲰⲦ ⲦⲎⲨⲦⲚ ⲘⲠⲢⲰⲘⲈ ⲚⲂⲢⲢⲈ. ⲠⲀⲒ ⲚⲦⲀⲨⲤⲞⲚⲦϤ ⲔⲀⲦⲀⲠⲚⲞⲨⲦⲈ. ϨⲚ ⲞⲨⲆⲒⲔⲀⲒⲞⲤⲨⲚⲎ ⲘⲚ ⲞⲨⲞⲨⲞⲠ ⲚⲦⲈⲦⲘⲈ.
Ephesians	Eph	10	4	25	ⲈⲦⲂⲈ ⲠⲀⲒ ⲈⲀⲦⲈⲦⲚⲔⲰ ⲚⲤⲰⲦⲚ ⲘⲠϬⲞⲖ ϢⲀϪⲈ ϨⲚ ⲦⲘⲈ. ⲠⲞⲨⲀ ⲠⲞⲨⲀ ⲘⲚ ⲠⲈⲐⲒⲦⲞⲨⲰϤ. ϪⲈ ⲀⲚⲞⲚ ⲘⲘⲈⲖⲞⲤ ⲚⲚⲈⲚⲈⲢⲎⲨ.
Ephesians	Eph	10	4	26	ⲚⲞⲨϬⲤ ⲘⲠⲢⲢⲚⲞⲂⲈ. ⲠⲢⲎ ⲘⲠⲢⲦⲢⲈϤϨⲰⲦⲠ ⲈⲠⲈⲦⲚⲚⲞⲨϬⲤ.
Ephesians	Eph	10	4	27	ⲞⲨⲆⲈ ⲘⲠⲢϮⲘⲀ ⲘⲠⲆⲒⲀⲂⲞⲖⲞⲤ.
Ephesians	Eph	10	4	28	ⲠⲈⲦϨⲰϤⲦ ⲘⲠⲢⲦⲢⲈϤϨⲰϤⲦ ϪⲒⲚ ⲦⲈⲚⲞⲨ. ⲀⲖⲖⲀ ⲘⲀⲢⲈϤϨⲒⲤⲈ ⲚⲦⲞϤ ⲈϤⲢϨⲰⲂ ϨⲚ ⲚⲈϤϬⲒϪ ϪⲈⲔⲀⲀⲤ ⲈϤⲈϢⲰⲠⲈ ⲈⲨⲚⲦⲀϤ ⲘⲘⲀⲨ ⲘⲠⲠⲈⲦⲚⲀⲚⲞⲨϤ ⲈϮ ⲘⲠⲈⲦϢⲀⲀⲦ.
Ephesians	Eph	10	4	29	ϢⲀϪⲈ ⲚⲒⲘ ⲈⲐⲞⲞⲨ ⲘⲠⲢⲦⲢⲈⲨⲈⲒ ⲈⲂⲞⲖ ϨⲚ ⲢⲰⲦⲚ. ⲀⲖⲖⲀ ⲞⲨⲞⲚ ⲚⲒⲘ ⲈⲦⲚⲀⲚⲞⲨⲞⲨ ⲠⲢⲞⲤⲠⲔⲰⲦ ⲚⲦⲈⲬⲢⲒⲀ. ϪⲈⲔⲀⲀⲤ ⲈϤⲈϮ ⲚⲞⲨⲬⲀⲢⲒⲤ ⲚⲚⲈⲦⲤⲰⲦⲘ.
Ephesians	Eph	10	4	30	ⲀⲨⲰ ⲘⲠⲢⲖⲨⲠⲈⲒ ⲘⲠⲈⲠⲚⲈⲨⲘⲀ ⲈⲦⲞⲨⲀⲀⲂ ⲘⲠⲚⲞⲨⲦⲈ ⲠⲀⲒ ⲈⲚⲦⲀⲨⲤⲪⲢⲀⲄⲒⲌⲈ ⲘⲘⲰⲦⲚ ⲚϨⲎⲦϤ ⲈⲠⲈϨⲞⲞⲨ ⲘⲠⲤⲰⲦⲈ.
Ephesians	Eph	10	4	31	ⲚⲞⲨϬⲤ ⲚⲒⲘ ϬⲰⲚⲦ ⲚⲒⲘ ⲞⲢⲄⲎ ⲚⲒⲘ ⲀϢⲔⲀⲔ ⲚⲒⲘ ϨⲒ ϪⲒⲞⲨⲀ ϤⲒⲦⲞⲨ ⲚϨⲎⲦ ⲦⲎⲨⲦⲚ ⲘⲚ ⲔⲀⲔⲒⲀ ⲚⲒⲘ.
Ephesians	Eph	10	4	32	ϢⲰⲠⲈ ⲆⲈ ⲚⲬⲢⲎⲤⲦⲞⲤ ⲈϨⲞⲨⲚ ⲈⲚⲈⲦⲚⲈⲢⲎⲨ ⲚϢⲀⲚϨⲦⲎϤ. ⲈⲦⲈⲦⲚⲔⲰ ⲈⲂⲞⲖ ⲚⲚⲈⲦⲚⲈⲢⲎⲨ. ⲔⲀⲦⲀ ⲐⲈ ⲈⲚⲦⲀ ⲠⲚⲞⲨⲦⲈ ⲔⲰ ⲚⲎⲦⲚ ⲈⲂⲞⲖ ϨⲘ ⲠⲈⲬⲢⲒⲤⲦⲞⲤ.
Ephesians	Eph	10	5	1	ϢⲰⲠⲈ ϬⲈ ⲈⲦⲈⲦⲚⲦⲚⲦⲰⲚ ⲈⲠⲚⲞⲨⲦⲈ ϨⲰⲤ ϢⲎⲢⲈ ⲘⲘⲈⲢⲒⲦ.
Ephesians	Eph	10	5	2	ⲀⲨⲰ ⲚⲦⲈⲦⲚ ⲘⲞⲞϢⲈ ϨⲚ ⲞⲨⲀⲄⲀⲠⲎ ⲔⲀⲦⲀ ⲐⲈ ⲈⲚⲦⲀ ⲠⲈⲬⲢⲒⲤⲦⲞⲤ ⲘⲈⲢⲈ ⲦⲎⲨⲦⲚ. ⲀⲨⲰ ⲀϤⲦⲀⲀϤ ϨⲀⲢⲰⲦⲚ ⲘⲠⲢⲞⲤⲪⲞⲢⲀ. ⲀⲨⲰ ⲚⲐⲨⲤⲒⲀ ⲘⲠⲚⲞⲨⲦⲈ ⲈⲨⲤϮⲚⲞⲨϤⲈ.
Ephesians	Eph	10	5	3	ⲠⲞⲢⲚⲈⲒⲀ ⲆⲈ ⲚⲒⲘ ϨⲒ ⲀⲔⲀⲐⲀⲢⲤⲒⲀ. ⲎⲞⲨⲘⲚⲦⲘⲀⲒⲦⲞ ⲚϨⲞⲨⲞ ⲘⲠⲢⲦⲢⲈⲨⲦⲀⲨ ⲈⲢⲒⲚⲞⲨ ⲢⲰ ⲚϨⲎⲦ ⲦⲎⲨⲦⲚ. ⲔⲀⲦⲀ ⲐⲈ ⲈⲦⲠⲢⲈⲠⲈⲒ ⲚⲚⲈⲦⲞⲨⲀⲀⲂ.
Ephesians	Eph	10	5	4	ⲎⲞⲨϢⲖⲞϤ ⲎⲞⲨϢϪⲤⲞϬ ⲎⲞⲨⲖⲖⲎⲂ ⲚⲀⲒ ⲈⲦⲈⲘⲈϢϢⲈ ⲀⲖⲖⲀ ⲞⲨϢⲠϨⲘⲞⲦ ⲚⲦⲞϤ.
Ephesians	Eph	10	5	5	ⲠⲀⲒ ⲄⲀⲢ ⲦⲈⲦⲚⲤⲞⲞⲨⲚ ⲘⲘⲞϤ ⲈⲦⲈⲦⲚⲈⲒⲘⲈ ϪⲈ ⲠⲞⲢⲚⲞⲤ ⲚⲒⲘ ⲎⲀⲔⲀⲐⲀⲢⲦⲞⲤ ⲎⲘⲀⲒⲦⲞ ⲚϨⲞⲨⲞ ⲈⲦⲈ ⲠⲀⲒ ⲠⲈ ⲢⲈϤϢⲘϢⲈ ⲈⲒⲆⲰⲖⲞⲚ ⲘⲚ ⲦϤⲔⲖⲎⲢⲞⲚⲞⲘⲒⲀ ⲘⲘⲀⲨ ϨⲚ ⲦⲘⲚⲦⲢⲢⲞ ⲘⲠⲈⲬⲢⲒⲤⲦⲞⲤ ⲘⲚⲠⲚⲞⲨⲦⲈ.
Ephesians	Eph	10	5	6	ⲘⲠⲢⲦⲢⲈ ⲖⲀⲀⲨ ⲢϨⲀⲖ ⲘⲘⲰⲦⲚ ϨⲚ ϨⲈⲚϢⲀϪⲈ ⲈⲨϢⲞⲨⲒⲦ ⲈⲢⲈ ⲦⲞⲢⲄⲎ ⲄⲀⲢ ⲘⲠⲚⲞⲨⲦⲈ ⲚⲎⲨ ⲈⲦⲂⲈ ⲚⲀⲒ ⲈϪⲚ ⲚϢⲎⲢⲈ ⲚⲦⲘⲚⲦⲀⲦⲚⲀϨⲦⲈ.
Ephesians	Eph	10	5	7	ⲘⲠⲢϢⲰⲠⲈ ϬⲈ ⲈⲦⲈⲦⲚϬⲎⲠ ⲈⲢⲞⲞⲨ.
Ephesians	Eph	10	5	8	ⲘⲠⲒⲞⲨⲞⲈⲒϢ ⲄⲀⲢ ⲈⲦⲈⲦⲚⲞ ⲚⲔⲀⲔⲈ ⲠⲈ. ⲦⲈⲚⲞⲨ ⲆⲈ ⲚⲞⲨⲞⲈⲒⲚ ϨⲘ ⲠϪⲞⲈⲒⲤ. ⲘⲞⲞϢⲈ ϨⲰⲤ ϢⲎⲢⲈ ⲘⲠⲞⲨⲞⲈⲒⲚ.
Ephesians	Eph	10	5	9	ⲈⲢⲈ ⲠⲔⲀⲢⲠⲞⲤ ⲄⲀⲢ ⲘⲠⲞⲨⲞⲈⲒⲚ ϨⲘ ⲠⲠⲈⲦⲚⲀⲚⲞⲨϤ ⲚⲒⲘ ⲘⲚⲦⲆⲒⲔⲀⲒⲞⲤⲨⲚⲎ. ⲘⲚ ⲦⲘⲈ.
Ephesians	Eph	10	5	10	ⲈⲦⲈⲦⲚⲆⲞⲔⲒⲘⲀⲌⲈ ϪⲈ ⲞⲨ ⲠⲈⲦⲢⲀⲚⲀϤ ⲘⲠϪⲞⲈⲒⲤ.
Ephesians	Eph	10	5	11	ⲀⲨⲰ ⲘⲠⲢⲔⲞⲒⲚⲰⲚⲒ ⲈⲚⲈϨⲂⲎⲨⲈ ⲘⲠⲔⲀⲔⲈ ⲈⲦⲈⲘⲚⲦⲞⲨ ⲔⲀⲢⲠⲞⲤ. ⲚⲦⲈⲦⲚ ϪⲠⲒⲞⲞⲨ ⲆⲈ ⲚⲦⲞϤ ⲚϨⲞⲨⲞ.
Ephesians	Eph	10	5	12	ⲚⲈⲦⲞⲨⲈⲒⲢⲈ ⲄⲀⲢ ⲘⲘⲞⲞⲨ ⲚϪⲒⲞⲨⲈ ϨⲈⲚϢⲖⲞϤ ⲈⲢⲠⲔⲈϪⲞⲞⲨ ⲚⲈ.
Ephesians	Eph	10	5	13	ϢⲀⲢⲈ ϨⲰⲂ ⲆⲈ ⲚⲒⲘ ⲞⲨⲰⲚϨ ⲈⲂⲞⲖ ⲈⲦⲞⲨϪⲠⲒⲞ ⲘⲘⲞⲞⲨ ϨⲒⲦⲘ ⲠⲞⲨⲞⲈⲒⲚ. ϨⲰⲂ ⲄⲀⲢ ⲚⲒⲘ ⲈⲦⲞⲨⲞⲚϨ ⲈⲂⲞⲖ ϨⲈⲚⲞⲨⲞⲈⲒⲚ ⲚⲈ.
Ephesians	Eph	10	5	14	ⲈⲦⲂⲈ ⲠⲀⲒ ϤϪⲰ ⲘⲘⲞⲤ ϪⲈ ⲦⲰⲞⲨⲚⲄ ⲠⲈⲦⲚⲔⲞⲦⲔ ⲚⲄⲖⲞ ⲞⲨⲦⲈ ⲚⲈⲦⲘⲞⲞⲨⲦ ⲦⲀⲢⲈ ⲠⲈⲬⲢⲒⲤⲦⲞⲤ ⲢⲞⲨⲞⲈⲒⲚ ⲈⲢⲞⲔ.
Ephesians	Eph	10	5	15	ϬⲰϢⲦ ϬⲈ ϨⲚ ⲞⲨⲰⲢϪ ϪⲈ ⲈⲦⲈⲦⲚⲘⲞⲞϢⲈ ⲚⲀϢ ⲚϨⲈ ϨⲰⲤ ⲀⲐⲎⲦ ⲀⲚ. ⲀⲖⲖⲀ ϨⲰⲤ ⲤⲀⲂⲈ.
Ephesians	Eph	10	5	16	ⲈⲦⲈⲦⲚϢⲰⲠ ⲘⲠⲈⲨⲞⲈⲒϢ ϪⲈ ⲚⲈϨⲞⲞⲨ ϨⲞⲞⲨ.
Ephesians	Eph	10	5	17	ⲈⲦⲂⲈ ⲠⲀⲒ ⲘⲠⲢϢⲰⲠⲈ ⲚⲀⲐⲎⲦ ⲀⲖⲖⲀ ⲈⲒⲘⲈ ϪⲈ ⲞⲨ ⲠⲈ ⲠⲞⲨⲰϢ ⲘⲠϪⲞⲈⲒⲤ.
Ephesians	Eph	10	5	18	ⲀⲨⲰ ⲘⲠⲢϮϨⲈ ϨⲚ ⲞⲨⲎⲢⲠ ⲠⲀⲒ ⲈⲦⲈⲞⲨⲚ ⲞⲨⲘⲚⲦϢⲚⲀ ϢⲞⲞⲠ ⲚϨⲎⲦϤ. ⲀⲖⲖⲀ ⲚⲦⲈⲦⲚ ϪⲰⲔ ⲈⲂⲞⲖ ϨⲘ ⲠⲈⲠⲚⲈⲨⲘⲀ.
Ephesians	Eph	10	5	19	ⲈⲦⲈⲦⲚϢⲀϪⲈ ⲘⲚ ⲚⲈⲦⲚⲈⲢⲎⲨ ϨⲚ ϨⲈⲚⲮⲀⲖⲘⲞⲤ. ⲘⲚ ϨⲈⲚⲤⲘⲞⲨ. ⲘⲚ ϨⲈⲚⲰⲆⲎ ⲘⲠⲚⲈⲨⲘⲀⲦⲒⲔⲞⲚ ⲈⲦⲈⲦⲚϪⲰ ⲀⲨⲰ ⲈⲦⲈⲦⲚⲮⲀⲖⲖⲒ ϨⲚ ⲚⲈⲦⲚϨⲎⲦ ⲈⲠϪⲞⲈⲒⲤ.
Ephesians	Eph	10	5	20	ⲈⲦⲈⲦⲚϢⲠϨⲘⲞⲦ ⲚⲞⲨⲞⲈⲒϢ ⲚⲒⲘ ϨⲀ ⲞⲨⲞⲚ ⲚⲒⲘ ϨⲘ ⲠⲢⲀⲚ ⲘⲠⲈⲚϪⲞⲈⲒⲤ ⲒⲎⲤⲞⲨⲤ ⲠⲈⲬⲢⲒⲤⲦⲞⲤ ⲚⲦⲘⲠⲚⲞⲨⲦⲈ ⲠⲈⲒⲰⲦ
Ephesians	Eph	10	5	21	ⲈⲦⲈⲦⲚϨⲨⲠⲞⲦⲀⲤⲤⲈ ⲚⲚⲈⲦⲚⲈⲢⲎⲨ ϨⲚ ⲐⲞⲦⲈ ⲘⲠⲈⲬⲢⲒⲤⲦⲞⲤ.
Ephesians	Eph	10	5	22	ⲚⲈϨⲒⲞⲘⲈ ⲘⲀⲢⲞⲨϨⲨⲠⲞⲦⲀⲤⲤⲈ ⲚⲚⲈⲨϨⲀⲒ ⲚⲐⲈ ⲘⲠϪⲞⲈⲒⲤ.
Ephesians	Eph	10	5	23	ϪⲈ ⲠϨⲞⲞⲨⲦ ⲦⲀⲠⲈ ⲠⲈ ⲚⲦⲈⲤϨⲒⲘⲈ ⲚⲐⲈ ⲘⲠⲈⲬⲢⲒⲤⲦⲞⲤ ⲈⲦⲀⲠⲈ ⲠⲈ ⲚⲦⲈⲔⲔⲖⲎⲤⲒⲀ. ⲚⲦⲞϤ ⲠⲈ ⲠⲤⲰⲦⲎⲢ ⲘⲠⲤⲰⲘⲀ.
Ephesians	Eph	10	5	24	ⲀⲖⲖⲀ ⲚⲐⲈ ⲈⲦⲈⲢⲈ ⲦⲈⲔⲔⲖⲎⲤⲒⲀ ϨⲨⲠⲞⲦⲀⲤⲤⲈ ⲘⲠⲈⲬⲢⲒⲤⲦⲞⲤ. ⲦⲀⲒ ϨⲰⲰϤ ⲦⲈ ⲐⲈ. ⲘⲀⲢⲈ ⲚⲈϨⲒⲞⲘⲈ ϨⲰⲞⲨ ϨⲨⲠⲞⲦⲀⲤⲤⲈ ⲚⲚⲈⲨϨⲀⲒ ϨⲚ ϨⲰⲂ ⲚⲒⲘ.
Ephesians	Eph	10	5	25	ⲚϨⲞⲞⲨⲦ ⲘⲈⲢⲈ ⲚⲈⲦⲚϨⲒⲞⲘⲈ ⲔⲀⲦⲀ ⲐⲈ ⲈⲚⲦⲀ ⲠⲈⲬⲢⲒⲤⲦⲞⲤ ⲘⲈⲢⲈ ⲦⲈⲔⲔⲖⲎⲤⲒⲀ. ⲀⲨⲰ ⲀϤⲦⲀⲀϤ ϨⲀⲢⲞⲤ
Ephesians	Eph	10	5	26	ϪⲈ ⲈϤⲈⲦⲂⲂⲞⲤ. ⲈⲀϤⲔⲀⲐⲀⲢⲒⲌⲈ ⲘⲘⲞⲤ ϨⲘ ⲠϢⲀϪⲈ ⲘⲚ ⲠϪⲰⲔⲘ ⲘⲠⲘⲞⲞⲨ.
